,number,value,datetime_start,datetime_complete,duration,params_bootstrap,params_class_weight,params_criterion,params_max_depth,params_max_depth_choice,params_max_features,params_min_samples_leaf,params_min_samples_split,params_n_estimators,state
0,0,0.8225971177944862,2026-06-08 00:51:26.617536,2026-06-08 00:51:27.377398,0 days 00:00:00.759862,True,,gini,24.0,depth,log2,2,4,500,COMPLETE
1,1,0.8435350297850298,2026-06-08 00:51:27.377398,2026-06-08 00:51:28.195754,0 days 00:00:00.818356,True,,gini,,none,0.5,3,4,500,COMPLETE
2,2,0.7259946948826106,2026-06-08 00:51:28.195754,2026-06-08 00:51:28.458927,0 days 00:00:00.263173,True,balanced_subsample,entropy,,none,0.75,5,15,100,COMPLETE
3,3,0.7285233538290398,2026-06-08 00:51:28.458927,2026-06-08 00:51:29.585468,0 days 00:00:01.126541,True,balanced_subsample,entropy,,none,0.75,1,19,500,COMPLETE
4,4,0.7512542895946257,2026-06-08 00:51:29.585468,2026-06-08 00:51:29.893544,0 days 00:00:00.308076,False,,gini,,none,0.5,9,2,200,COMPLETE
5,5,0.7399677478855377,2026-06-08 00:51:29.893544,2026-06-08 00:51:31.485486,0 days 00:00:01.591942,True,balanced_subsample,entropy,,none,0.75,2,10,700,COMPLETE
6,6,0.688878140480626,2026-06-08 00:51:31.486489,2026-06-08 00:51:32.075071,0 days 00:00:00.588582,False,balanced,gini,10.0,depth,0.75,3,16,300,COMPLETE
7,7,0.7646995072950883,2026-06-08 00:51:32.075599,2026-06-08 00:51:32.292672,0 days 00:00:00.217073,True,,entropy,,none,log2,5,6,100,COMPLETE
8,8,0.7926451900408258,2026-06-08 00:51:32.293194,2026-06-08 00:51:32.658826,0 days 00:00:00.365632,False,balanced_subsample,gini,32.0,depth,0.5,4,11,200,COMPLETE
9,9,0.7262992971926343,2026-06-08 00:51:32.659826,2026-06-08 00:51:34.039764,0 days 00:00:01.379938,True,balanced_subsample,entropy,10.0,depth,0.75,7,8,600,COMPLETE
10,10,0.7263825229514662,2026-06-08 00:51:34.040765,2026-06-08 00:51:34.583570,0 days 00:00:00.542805,False,balanced,gini,,none,sqrt,7,2,400,COMPLETE
11,11,0.7738244764943794,2026-06-08 00:51:34.583570,2026-06-08 00:51:35.325596,0 days 00:00:00.742026,True,,gini,26.0,depth,log2,1,5,500,COMPLETE
12,12,0.7651414434561885,2026-06-08 00:51:35.325596,2026-06-08 00:51:36.288873,0 days 00:00:00.963277,True,,gini,20.0,depth,,3,5,500,COMPLETE
13,13,0.8314911150277005,2026-06-08 00:51:36.289376,2026-06-08 00:51:37.435190,0 days 00:00:01.145814,True,,gini,20.0,depth,0.5,3,8,700,COMPLETE
14,14,0.7865200470367549,2026-06-08 00:51:37.435190,2026-06-08 00:51:38.599577,0 days 00:00:01.164387,True,,gini,,none,0.5,4,9,700,COMPLETE
15,15,0.6461569406683961,2026-06-08 00:51:38.600579,2026-06-08 00:51:39.605029,0 days 00:00:01.004450,True,,gini,16.0,depth,0.5,10,13,600,COMPLETE
16,16,0.7414873022528942,2026-06-08 00:51:39.605563,2026-06-08 00:51:40.499307,0 days 00:00:00.893744,True,,gini,6.0,depth,0.5,7,7,600,COMPLETE
17,17,0.7129326504412368,2026-06-08 00:51:40.499307,2026-06-08 00:51:41.791520,0 days 00:00:01.292213,True,balanced,gini,,none,,3,13,700,COMPLETE
18,18,0.7809742057013132,2026-06-08 00:51:41.791520,2026-06-08 00:51:42.320075,0 days 00:00:00.528555,False,,gini,16.0,depth,sqrt,6,3,400,COMPLETE
19,19,0.7725634234780576,2026-06-08 00:51:42.320075,2026-06-08 00:51:43.301128,0 days 00:00:00.981053,True,,gini,,none,0.5,4,7,600,COMPLETE
20,20,0.7824063318242493,2026-06-08 00:51:43.301774,2026-06-08 00:51:43.844905,0 days 00:00:00.543131,True,balanced,gini,,none,0.5,2,9,300,COMPLETE
21,21,0.8225971177944862,2026-06-08 00:51:43.845904,2026-06-08 00:51:44.680483,0 days 00:00:00.834579,True,,gini,24.0,depth,log2,2,4,500,COMPLETE
22,22,0.8227954453880287,2026-06-08 00:51:44.681482,2026-06-08 00:51:45.333300,0 days 00:00:00.651818,True,,gini,28.0,depth,log2,1,4,400,COMPLETE
23,23,0.8144693633951573,2026-06-08 00:51:45.333300,2026-06-08 00:51:45.796892,0 days 00:00:00.463592,True,,gini,32.0,depth,log2,1,6,300,COMPLETE
24,24,0.8435350297850298,2026-06-08 00:51:45.797395,2026-06-08 00:51:46.448264,0 days 00:00:00.650869,True,,gini,26.0,depth,0.5,3,4,400,COMPLETE
25,25,0.8379763176638176,2026-06-08 00:51:46.448264,2026-06-08 00:51:47.099765,0 days 00:00:00.651501,True,,gini,20.0,depth,0.5,3,7,400,COMPLETE
26,26,0.8159085876075368,2026-06-08 00:51:47.100290,2026-06-08 00:51:47.723410,0 days 00:00:00.623120,False,,entropy,22.0,depth,0.5,4,2,400,COMPLETE
27,27,0.7404989720247073,2026-06-08 00:51:47.723928,2026-06-08 00:51:48.250342,0 days 00:00:00.526414,True,,gini,28.0,depth,0.5,6,6,300,COMPLETE
28,28,0.7645596313809948,2026-06-08 00:51:48.250342,2026-06-08 00:51:48.601817,0 days 00:00:00.351475,True,,gini,,none,sqrt,5,4,200,COMPLETE
29,29,0.7309970071944862,2026-06-08 00:51:48.603322,2026-06-08 00:51:49.576575,0 days 00:00:00.973253,True,balanced,gini,16.0,depth,,3,3,500,COMPLETE
