,number,value,datetime_start,datetime_complete,duration,params_bootstrap,params_class_weight,params_criterion,params_max_depth,params_max_depth_choice,params_max_features,params_min_samples_leaf,params_min_samples_split,params_n_estimators,state
0,0,0.6285264091578524,2026-06-08 00:50:56.060206,2026-06-08 00:50:56.867187,0 days 00:00:00.806981,True,,gini,24.0,depth,log2,2,4,500,COMPLETE
1,1,0.6576311809872785,2026-06-08 00:50:56.867187,2026-06-08 00:50:57.622698,0 days 00:00:00.755511,True,,gini,,none,0.5,3,4,500,COMPLETE
2,2,0.6704875205666345,2026-06-08 00:50:57.622698,2026-06-08 00:50:57.915463,0 days 00:00:00.292765,True,balanced_subsample,entropy,,none,0.75,5,15,100,COMPLETE
3,3,0.6770509719039131,2026-06-08 00:50:57.915463,2026-06-08 00:50:59.049932,0 days 00:00:01.134469,True,balanced_subsample,entropy,,none,0.75,1,19,500,COMPLETE
4,4,0.6502104737674452,2026-06-08 00:50:59.050469,2026-06-08 00:50:59.327430,0 days 00:00:00.276961,False,,gini,,none,0.5,9,2,200,COMPLETE
5,5,0.7577870971620972,2026-06-08 00:50:59.327950,2026-06-08 00:51:00.923813,0 days 00:00:01.595863,True,balanced_subsample,entropy,,none,0.75,2,10,700,COMPLETE
6,6,0.6782458738873213,2026-06-08 00:51:00.924818,2026-06-08 00:51:01.482774,0 days 00:00:00.557956,False,balanced,gini,10.0,depth,0.75,3,16,300,COMPLETE
7,7,0.6282094845513964,2026-06-08 00:51:01.482774,2026-06-08 00:51:01.698208,0 days 00:00:00.215434,True,,entropy,,none,log2,5,6,100,COMPLETE
8,8,0.7243933552000927,2026-06-08 00:51:01.699207,2026-06-08 00:51:02.057128,0 days 00:00:00.357921,False,balanced_subsample,gini,32.0,depth,0.5,4,11,200,COMPLETE
9,9,0.7021919045897592,2026-06-08 00:51:02.057647,2026-06-08 00:51:03.376186,0 days 00:00:01.318539,True,balanced_subsample,entropy,10.0,depth,0.75,7,8,600,COMPLETE
10,10,0.6639251705445071,2026-06-08 00:51:03.377186,2026-06-08 00:51:04.351581,0 days 00:00:00.974395,False,balanced,entropy,,none,sqrt,7,11,700,COMPLETE
11,11,0.6377098129291112,2026-06-08 00:51:04.352106,2026-06-08 00:51:04.999561,0 days 00:00:00.647455,False,balanced_subsample,gini,32.0,depth,,4,11,300,COMPLETE
12,12,0.750139422309593,2026-06-08 00:51:05.000560,2026-06-08 00:51:06.256568,0 days 00:00:01.256008,False,balanced_subsample,entropy,32.0,depth,0.5,1,9,700,COMPLETE
13,13,0.6190975490321395,2026-06-08 00:51:06.257096,2026-06-08 00:51:08.256974,0 days 00:00:01.999878,False,balanced_subsample,entropy,20.0,depth,,1,8,700,COMPLETE
14,14,0.6666109398919924,2026-06-08 00:51:08.257498,2026-06-08 00:51:09.637208,0 days 00:00:01.379710,True,balanced_subsample,entropy,,none,sqrt,1,14,700,COMPLETE
15,15,0.7590194287604748,2026-06-08 00:51:09.638208,2026-06-08 00:51:10.676825,0 days 00:00:01.038617,False,balanced_subsample,entropy,24.0,depth,0.5,2,7,600,COMPLETE
16,16,0.7190178916231007,2026-06-08 00:51:10.677347,2026-06-08 00:51:11.667123,0 days 00:00:00.989776,True,balanced,entropy,24.0,depth,0.5,3,6,600,COMPLETE
17,17,0.7177732761066093,2026-06-08 00:51:11.668123,2026-06-08 00:51:12.799564,0 days 00:00:01.131441,False,balanced_subsample,entropy,,none,0.75,7,13,600,COMPLETE
18,18,0.5232192990198697,2026-06-08 00:51:12.799564,2026-06-08 00:51:13.926718,0 days 00:00:01.127154,True,balanced_subsample,entropy,4.0,depth,log2,10,18,600,COMPLETE
19,19,0.700352596202743,2026-06-08 00:51:13.926718,2026-06-08 00:51:14.504628,0 days 00:00:00.577910,False,balanced,entropy,,none,sqrt,2,9,400,COMPLETE
20,20,0.6986263694716124,2026-06-08 00:51:14.504628,2026-06-08 00:51:15.449174,0 days 00:00:00.944546,True,balanced_subsample,entropy,,none,,6,6,400,COMPLETE
21,21,0.7553267065387698,2026-06-08 00:51:15.449696,2026-06-08 00:51:16.686352,0 days 00:00:01.236656,False,balanced_subsample,entropy,26.0,depth,0.5,2,9,700,COMPLETE
22,22,0.743235289094502,2026-06-08 00:51:16.687352,2026-06-08 00:51:17.875512,0 days 00:00:01.188160,False,balanced_subsample,entropy,24.0,depth,0.5,2,13,700,COMPLETE
23,23,0.7561423566291721,2026-06-08 00:51:17.875512,2026-06-08 00:51:18.962198,0 days 00:00:01.086686,False,balanced_subsample,entropy,18.0,depth,0.5,4,9,600,COMPLETE
24,24,0.7518505003517774,2026-06-08 00:51:18.962198,2026-06-08 00:51:19.839702,0 days 00:00:00.877504,False,balanced_subsample,entropy,16.0,depth,0.5,4,7,500,COMPLETE
25,25,0.7583066633332861,2026-06-08 00:51:19.840702,2026-06-08 00:51:21.068901,0 days 00:00:01.228199,False,balanced_subsample,entropy,16.0,depth,0.75,3,3,600,COMPLETE
26,26,0.7538758419616752,2026-06-08 00:51:21.068901,2026-06-08 00:51:22.272170,0 days 00:00:01.203269,False,balanced_subsample,entropy,12.0,depth,0.75,3,2,600,COMPLETE
27,27,0.7336770516105042,2026-06-08 00:51:22.273331,2026-06-08 00:51:23.322135,0 days 00:00:01.048804,False,balanced_subsample,entropy,14.0,depth,0.75,2,4,500,COMPLETE
28,28,0.6688430441279984,2026-06-08 00:51:23.322658,2026-06-08 00:51:24.330207,0 days 00:00:01.007549,True,,entropy,,none,0.75,3,3,600,COMPLETE
29,29,0.620352509095755,2026-06-08 00:51:24.330207,2026-06-08 00:51:25.057549,0 days 00:00:00.727342,True,balanced,gini,20.0,depth,log2,2,4,500,COMPLETE
