,number,value,datetime_start,datetime_complete,duration,params_bootstrap,params_class_weight,params_criterion,params_max_depth,params_max_depth_choice,params_max_features,params_min_samples_leaf,params_min_samples_split,params_n_estimators,state
0,0,0.6246039261664261,2026-06-08 00:50:26.679094,2026-06-08 00:50:27.364356,0 days 00:00:00.685262,True,,gini,24.0,depth,log2,2,4,500,COMPLETE
1,1,0.639184070570269,2026-06-08 00:50:27.364356,2026-06-08 00:50:28.176736,0 days 00:00:00.812380,True,,gini,,none,0.5,3,4,500,COMPLETE
2,2,0.7073975180592829,2026-06-08 00:50:28.176736,2026-06-08 00:50:28.499343,0 days 00:00:00.322607,True,balanced_subsample,entropy,,none,0.75,5,15,100,COMPLETE
3,3,0.6804039460902207,2026-06-08 00:50:28.499343,2026-06-08 00:50:29.692095,0 days 00:00:01.192752,True,balanced_subsample,entropy,,none,0.75,1,19,500,COMPLETE
4,4,0.6372912536493622,2026-06-08 00:50:29.692095,2026-06-08 00:50:30.015990,0 days 00:00:00.323895,False,,gini,,none,0.5,9,2,200,COMPLETE
5,5,0.7569904605198723,2026-06-08 00:50:30.015990,2026-06-08 00:50:31.645487,0 days 00:00:01.629497,True,balanced_subsample,entropy,,none,0.75,2,10,700,COMPLETE
6,6,0.6841589700821681,2026-06-08 00:50:31.646488,2026-06-08 00:50:32.183216,0 days 00:00:00.536728,False,balanced,gini,10.0,depth,0.75,3,16,300,COMPLETE
7,7,0.601843839966433,2026-06-08 00:50:32.183738,2026-06-08 00:50:32.373200,0 days 00:00:00.189462,True,,entropy,,none,log2,5,6,100,COMPLETE
8,8,0.731495112335879,2026-06-08 00:50:32.373200,2026-06-08 00:50:32.745226,0 days 00:00:00.372026,False,balanced_subsample,gini,32.0,depth,0.5,4,11,200,COMPLETE
9,9,0.6808943067979532,2026-06-08 00:50:32.745226,2026-06-08 00:50:34.062595,0 days 00:00:01.317369,True,balanced_subsample,entropy,10.0,depth,0.75,7,8,600,COMPLETE
10,10,0.6369937016160393,2026-06-08 00:50:34.063595,2026-06-08 00:50:35.024545,0 days 00:00:00.960950,False,balanced,entropy,,none,sqrt,7,11,700,COMPLETE
11,11,0.6375354995375847,2026-06-08 00:50:35.024545,2026-06-08 00:50:35.656121,0 days 00:00:00.631576,False,balanced_subsample,gini,32.0,depth,,4,11,300,COMPLETE
12,12,0.7590194287604748,2026-06-08 00:50:35.657120,2026-06-08 00:50:36.947316,0 days 00:00:01.290196,False,balanced_subsample,entropy,32.0,depth,0.5,1,9,700,COMPLETE
13,13,0.631280102849582,2026-06-08 00:50:36.947316,2026-06-08 00:50:39.001699,0 days 00:00:02.054383,False,balanced_subsample,entropy,20.0,depth,,1,8,700,COMPLETE
14,14,0.6401477022775313,2026-06-08 00:50:39.001699,2026-06-08 00:50:40.488449,0 days 00:00:01.486750,True,balanced_subsample,entropy,,none,sqrt,1,14,700,COMPLETE
15,15,0.7534126163728091,2026-06-08 00:50:40.488975,2026-06-08 00:50:41.572612,0 days 00:00:01.083637,False,balanced_subsample,entropy,24.0,depth,0.5,2,7,600,COMPLETE
16,16,0.635506421997964,2026-06-08 00:50:41.572612,2026-06-08 00:50:42.552789,0 days 00:00:00.980177,True,balanced,entropy,16.0,depth,0.5,10,13,600,COMPLETE
17,17,0.7625193828381346,2026-06-08 00:50:42.553311,2026-06-08 00:50:43.452895,0 days 00:00:00.899584,False,balanced_subsample,entropy,,none,0.75,3,9,400,COMPLETE
18,18,0.5273446990937178,2026-06-08 00:50:43.452895,2026-06-08 00:50:43.975289,0 days 00:00:00.522394,False,balanced_subsample,entropy,4.0,depth,log2,3,18,400,COMPLETE
19,19,0.6180530226876338,2026-06-08 00:50:43.975289,2026-06-08 00:50:44.548303,0 days 00:00:00.573014,False,balanced,entropy,,none,sqrt,7,9,400,COMPLETE
20,20,0.6328889635341248,2026-06-08 00:50:44.549303,2026-06-08 00:50:45.383951,0 days 00:00:00.834648,False,balanced_subsample,entropy,28.0,depth,,4,13,300,COMPLETE
21,21,0.7521527332353213,2026-06-08 00:50:45.383951,2026-06-08 00:50:46.699171,0 days 00:00:01.315220,False,balanced_subsample,entropy,,none,0.75,2,10,600,COMPLETE
22,22,0.7377297000304824,2026-06-08 00:50:46.699171,2026-06-08 00:50:48.218948,0 days 00:00:01.519777,False,balanced_subsample,entropy,,none,0.75,2,5,700,COMPLETE
23,23,0.7615412843421094,2026-06-08 00:50:48.219952,2026-06-08 00:50:49.409013,0 days 00:00:01.189061,True,balanced_subsample,entropy,,none,0.75,1,9,500,COMPLETE
24,24,0.7557695553767857,2026-06-08 00:50:49.409013,2026-06-08 00:50:50.601815,0 days 00:00:01.192802,False,balanced_subsample,entropy,,none,0.75,1,7,500,COMPLETE
25,25,0.7538937365079674,2026-06-08 00:50:50.602813,2026-06-08 00:50:51.358609,0 days 00:00:00.755796,False,balanced_subsample,entropy,,none,0.5,3,9,400,COMPLETE
26,26,0.7417617002883719,2026-06-08 00:50:51.359129,2026-06-08 00:50:52.519101,0 days 00:00:01.159972,True,balanced_subsample,entropy,,none,0.75,1,13,500,COMPLETE
27,27,0.7230307735742518,2026-06-08 00:50:52.520100,2026-06-08 00:50:53.352351,0 days 00:00:00.832251,False,balanced_subsample,entropy,,none,0.75,6,2,400,COMPLETE
28,28,0.6542121792786277,2026-06-08 00:50:53.352351,2026-06-08 00:50:53.911569,0 days 00:00:00.559218,True,,entropy,16.0,depth,0.5,2,6,300,COMPLETE
29,29,0.5990196920039547,2026-06-08 00:50:53.912091,2026-06-08 00:50:54.712010,0 days 00:00:00.799919,True,balanced,gini,26.0,depth,log2,2,12,500,COMPLETE
